[
  {
    "date": "2025-05-03",
    "description": "Oranje Spaarrekening Naar Oranje spaarrekening Z77815333 Valutadatum: 03-05-2025",
    "counterparty": "Oranje Spaarrekening",
    "amount": -250.0,
    "account": "ING",
    "subcategory": "Tussen rekeningen"
  },
  {
    "date": "2025-05-03",
    "description": "Oranje Spaarrekening Van Oranje spaarrekening B39371145 Valutadatum: 03-05-2025",
    "counterparty": "Oranje Spaarrekening",
    "amount": 100.0,
    "account": "ING",
    "subcategory": "Tussen rekeningen"
  },
  {
    "date": "2025-05-04",
    "description": "Oranje Spaarrekening Van Oranje spaarrekening X42802618 Valutadatum: 04-05-2025",
    "counterparty": "Oranje Spaarrekening",
    "amount": 74.0,
    "account": "ING",
    "subcategory": "Tussen rekeningen"
  },
  {
    "date": "2025-05-05",
    "description": "Oranje Spaarrekening Van Oranje spaarrekening B39371145 Valutadatum: 05-05-2025",
    "counterparty": "Oranje Spaarrekening",
    "amount": 200.0,
    "account": "ING",
    "subcategory": "Tussen rekeningen"
  },
  {
    "date": "2025-05-05",
    "description": "Oranje Spaarrekening Van Oranje spaarrekening B39371145 Valutadatum: 05-05-2025",
    "counterparty": "Oranje Spaarrekening",
    "amount": 130.0,
    "account": "ING",
    "subcategory": "Tussen rekeningen"
  },
  {
    "date": "2025-05-06",
    "description": "Oranje Spaarrekening Van Oranje spaarrekening B39371145 Valutadatum: 06-05-2025",
    "counterparty": "Oranje Spaarrekening",
    "amount": 100.0,
    "account": "ING",
    "subcategory": "Tussen rekeningen"
  },
  {
    "date": "2025-05-06",
    "description": "Oranje Spaarrekening Van Oranje spaarrekening B39371145 Valutadatum: 06-05-2025",
    "counterparty": "Oranje Spaarrekening",
    "amount": 80.0,
    "account": "ING",
    "subcategory": "Tussen rekeningen"
  },
  {
    "date": "2025-05-06",
    "description": "Oranje Spaarrekening Van Oranje spaarrekening X42802618 Valutadatum: 06-05-2025",
    "counterparty": "Oranje Spaarrekening",
    "amount": 125.0,
    "account": "ING",
    "subcategory": "Tussen rekeningen"
  },
  {
    "date": "2025-05-07",
    "description": "Oranje Spaarrekening Van Oranje spaarrekening B39371145 Valutadatum: 07-05-2025",
    "counterparty": "Oranje Spaarrekening",
    "amount": 300.0,
    "account": "ING",
    "subcategory": "Tussen rekeningen"
  },
  {
    "date": "2025-05-09",
    "description": "Oranje Spaarrekening Van Oranje spaarrekening B39371145 Valutadatum: 09-05-2025",
    "counterparty": "Oranje Spaarrekening",
    "amount": 90.0,
    "account": "ING",
    "subcategory": "Tussen rekeningen"
  },
  {
    "date": "2025-05-09",
    "description": "Oranje Spaarrekening Van Oranje spaarrekening B39371145 Valutadatum: 09-05-2025",
    "counterparty": "Oranje Spaarrekening",
    "amount": 100.0,
    "account": "ING",
    "subcategory": "Tussen rekeningen"
  },
  {
    "date": "2025-05-09",
    "description": "Oranje Spaarrekening Van Oranje spaarrekening B39371145 Valutadatum: 09-05-2025",
    "counterparty": "Oranje Spaarrekening",
    "amount": 300.0,
    "account": "ING",
    "subcategory": "Tussen rekeningen"
  },
  {
    "date": "2025-05-10",
    "description": "Oranje Spaarrekening Van Oranje spaarrekening B39371145 Valutadatum: 10-05-2025",
    "counterparty": "Oranje Spaarrekening",
    "amount": 200.0,
    "account": "ING",
    "subcategory": "Tussen rekeningen"
  },
  {
    "date": "2025-05-12",
    "description": "Oranje Spaarrekening Van Oranje spaarrekening X42802618 Valutadatum: 12-05-2025",
    "counterparty": "Oranje Spaarrekening",
    "amount": 115.5,
    "account": "ING",
    "subcategory": "Tussen rekeningen"
  },
  {
    "date": "2025-05-12",
    "description": "Oranje Spaarrekening Van Oranje spaarrekening B39371145 Valutadatum: 12-05-2025",
    "counterparty": "Oranje Spaarrekening",
    "amount": 730.0,
    "account": "ING",
    "subcategory": "Tussen rekeningen"
  },
  {
    "date": "2025-05-12",
    "description": "Oranje Spaarrekening Van Oranje spaarrekening B39371145 Valutadatum: 12-05-2025",
    "counterparty": "Oranje Spaarrekening",
    "amount": 100.0,
    "account": "ING",
    "subcategory": "Tussen rekeningen"
  },
  {
    "date": "2025-05-15",
    "description": "Oranje Spaarrekening Van Oranje spaarrekening B39371145 Valutadatum: 15-05-2025",
    "counterparty": "Oranje Spaarrekening",
    "amount": 213.0,
    "account": "ING",
    "subcategory": "Tussen rekeningen"
  },
  {
    "date": "2025-05-15",
    "description": "Oranje Spaarrekening Van Oranje spaarrekening B39371145 Valutadatum: 15-05-2025",
    "counterparty": "Oranje Spaarrekening",
    "amount": 100.0,
    "account": "ING",
    "subcategory": "Tussen rekeningen"
  },
  {
    "date": "2025-05-16",
    "description": "Oranje Spaarrekening Van Oranje spaarrekening B39371145 Valutadatum: 16-05-2025",
    "counterparty": "Oranje Spaarrekening",
    "amount": 50.0,
    "account": "ING",
    "subcategory": "Tussen rekeningen"
  },
  {
    "date": "2025-05-17",
    "description": "Oranje Spaarrekening Van Oranje spaarrekening B39371145 Valutadatum: 17-05-2025",
    "counterparty": "Oranje Spaarrekening",
    "amount": 50.0,
    "account": "ING",
    "subcategory": "Tussen rekeningen"
  },
  {
    "date": "2025-05-18",
    "description": "Oranje Spaarrekening Van Oranje spaarrekening B39371145 Valutadatum: 18-05-2025",
    "counterparty": "Oranje Spaarrekening",
    "amount": 50.0,
    "account": "ING",
    "subcategory": "Tussen rekeningen"
  },
  {
    "date": "2025-05-20",
    "description": "Oranje Spaarrekening Van Oranje spaarrekening D12277903 Valutadatum: 20-05-2025",
    "counterparty": "Oranje Spaarrekening",
    "amount": 770.0,
    "account": "ING",
    "subcategory": "Tussen rekeningen"
  },
  {
    "date": "2025-05-20",
    "description": "Oranje Spaarrekening Van Oranje spaarrekening X42802618 Valutadatum: 20-05-2025",
    "counterparty": "Oranje Spaarrekening",
    "amount": 81.0,
    "account": "ING",
    "subcategory": "Tussen rekeningen"
  },
  {
    "date": "2025-05-22",
    "description": "Oranje Spaarrekening Naar Oranje spaarrekening D12277903 Valutadatum: 22-05-2025",
    "counterparty": "Oranje Spaarrekening",
    "amount": -77.1,
    "account": "ING",
    "subcategory": "Tussen rekeningen"
  },
  {
    "date": "2025-05-22",
    "description": "J. Lek eo Kim Schut Naam: J. Lek eo Kim Schut Omschrijving: Vaste lasten IBAN: NL50RABO0330139916 Datum/Tijd: 22-05-2025 14:56:49 Valutadatum: 22-05-2025",
    "counterparty": "J. Lek eo Kim Schut",
    "amount": -3100.0,
    "account": "ING",
    "subcategory": "Tussen rekeningen"
  },
  {
    "date": "2025-05-22",
    "description": "Oranje Spaarrekening Naar Oranje spaarrekening B39371145 Valutadatum: 22-05-2025",
    "counterparty": "Oranje Spaarrekening",
    "amount": -1000.0,
    "account": "ING",
    "subcategory": "Tussen rekeningen"
  },
  {
    "date": "2025-05-22",
    "description": "Oranje Spaarrekening Naar Oranje spaarrekening Z77815333 Valutadatum: 22-05-2025",
    "counterparty": "Oranje Spaarrekening",
    "amount": -250.0,
    "account": "ING",
    "subcategory": "Tussen rekeningen"
  },
  {
    "date": "2025-05-22",
    "description": "Oranje Spaarrekening Naar Oranje spaarrekening X42802618 Valutadatum: 22-05-2025",
    "counterparty": "Oranje Spaarrekening",
    "amount": -500.0,
    "account": "ING",
    "subcategory": "Tussen rekeningen"
  },
  {
    "date": "2025-05-22",
    "description": "Oranje Spaarrekening Naar Oranje spaarrekening K55335889 Valutadatum: 22-05-2025",
    "counterparty": "Oranje Spaarrekening",
    "amount": -50.0,
    "account": "ING",
    "subcategory": "Tussen rekeningen"
  },
  {
    "date": "2025-05-27",
    "description": "Oranje Spaarrekening Van Oranje spaarrekening X42802618 Valutadatum: 27-05-2025",
    "counterparty": "Oranje Spaarrekening",
    "amount": 100.0,
    "account": "ING",
    "subcategory": "Tussen rekeningen"
  },
  {
    "date": "2025-06-03",
    "description": "Oranje Spaarrekening Van Oranje spaarrekening X42802618 Valutadatum: 03-06-2025",
    "counterparty": "Oranje Spaarrekening",
    "amount": 89.0,
    "account": "ING",
    "subcategory": "Tussen rekeningen"
  },
  {
    "date": "2025-06-06",
    "description": "Oranje Spaarrekening Van Oranje spaarrekening B39371145 Valutadatum: 06-06-2025",
    "counterparty": "Oranje Spaarrekening",
    "amount": 100.0,
    "account": "ING",
    "subcategory": "Tussen rekeningen"
  },
  {
    "date": "2025-06-07",
    "description": "Oranje Spaarrekening Van Oranje spaarrekening B39371145 Valutadatum: 07-06-2025",
    "counterparty": "Oranje Spaarrekening",
    "amount": 100.0,
    "account": "ING",
    "subcategory": "Tussen rekeningen"
  },
  {
    "date": "2025-06-08",
    "description": "Oranje Spaarrekening Van Oranje spaarrekening B39371145 Valutadatum: 08-06-2025",
    "counterparty": "Oranje Spaarrekening",
    "amount": 300.0,
    "account": "ING",
    "subcategory": "Tussen rekeningen"
  },
  {
    "date": "2025-06-08",
    "description": "Oranje Spaarrekening Van Oranje spaarrekening X42802618 Valutadatum: 08-06-2025",
    "counterparty": "Oranje Spaarrekening",
    "amount": 11.0,
    "account": "ING",
    "subcategory": "Tussen rekeningen"
  },
  {
    "date": "2025-06-09",
    "description": "Oranje Spaarrekening Van Oranje spaarrekening X42802618 Valutadatum: 09-06-2025",
    "counterparty": "Oranje Spaarrekening",
    "amount": 100.0,
    "account": "ING",
    "subcategory": "Tussen rekeningen"
  },
  {
    "date": "2025-06-09",
    "description": "Oranje Spaarrekening Van Oranje spaarrekening X42802618 Valutadatum: 09-06-2025",
    "counterparty": "Oranje Spaarrekening",
    "amount": 106.0,
    "account": "ING",
    "subcategory": "Tussen rekeningen"
  },
  {
    "date": "2025-06-10",
    "description": "Oranje Spaarrekening Van Oranje spaarrekening D12277903 Valutadatum: 10-06-2025",
    "counterparty": "Oranje Spaarrekening",
    "amount": 2827.0,
    "account": "ING",
    "subcategory": "Tussen rekeningen"
  },
  {
    "date": "2025-06-15",
    "description": "Oranje Spaarrekening Van Oranje spaarrekening X42802618 Valutadatum: 15-06-2025",
    "counterparty": "Oranje Spaarrekening",
    "amount": 20.0,
    "account": "ING",
    "subcategory": "Tussen rekeningen"
  },
  {
    "date": "2025-06-15",
    "description": "Oranje Spaarrekening Van Oranje spaarrekening B39371145 Valutadatum: 15-06-2025",
    "counterparty": "Oranje Spaarrekening",
    "amount": 40.0,
    "account": "ING",
    "subcategory": "Tussen rekeningen"
  },
  {
    "date": "2025-06-16",
    "description": "Oranje Spaarrekening Van Oranje spaarrekening B39371145 Valutadatum: 16-06-2025",
    "counterparty": "Oranje Spaarrekening",
    "amount": 100.0,
    "account": "ING",
    "subcategory": "Tussen rekeningen"
  },
  {
    "date": "2025-06-16",
    "description": "Oranje Spaarrekening Van Oranje spaarrekening X42802618 Valutadatum: 16-06-2025",
    "counterparty": "Oranje Spaarrekening",
    "amount": 74.0,
    "account": "ING",
    "subcategory": "Tussen rekeningen"
  },
  {
    "date": "2025-06-16",
    "description": "Oranje Spaarrekening Van Oranje spaarrekening B39371145 Valutadatum: 16-06-2025",
    "counterparty": "Oranje Spaarrekening",
    "amount": 80.0,
    "account": "ING",
    "subcategory": "Tussen rekeningen"
  },
  {
    "date": "2025-06-17",
    "description": "Oranje Spaarrekening Van Oranje spaarrekening W12025282 Valutadatum: 17-06-2025",
    "counterparty": "Oranje Spaarrekening",
    "amount": 110.0,
    "account": "ING",
    "subcategory": "Tussen rekeningen"
  },
  {
    "date": "2025-06-18",
    "description": "Oranje Spaarrekening Van Oranje spaarrekening B39371145 Valutadatum: 18-06-2025",
    "counterparty": "Oranje Spaarrekening",
    "amount": 50.0,
    "account": "ING",
    "subcategory": "Tussen rekeningen"
  },
  {
    "date": "2025-06-18",
    "description": "Oranje Spaarrekening Van Oranje spaarrekening B39371145 Valutadatum: 18-06-2025",
    "counterparty": "Oranje Spaarrekening",
    "amount": 50.0,
    "account": "ING",
    "subcategory": "Tussen rekeningen"
  },
  {
    "date": "2025-06-18",
    "description": "Oranje Spaarrekening Van Oranje spaarrekening B39371145 Valutadatum: 18-06-2025",
    "counterparty": "Oranje Spaarrekening",
    "amount": 100.0,
    "account": "ING",
    "subcategory": "Tussen rekeningen"
  },
  {
    "date": "2025-06-20",
    "description": "Oranje Spaarrekening Naar Oranje spaarrekening B39371145 Valutadatum: 20-06-2025",
    "counterparty": "Oranje Spaarrekening",
    "amount": -400.0,
    "account": "ING",
    "subcategory": "Tussen rekeningen"
  },
  {
    "date": "2025-06-20",
    "description": "Oranje Spaarrekening Naar Oranje spaarrekening R12933395 Valutadatum: 20-06-2025",
    "counterparty": "Oranje Spaarrekening",
    "amount": -1939.0,
    "account": "ING",
    "subcategory": "Tussen rekeningen"
  },
  {
    "date": "2025-06-23",
    "description": "Oranje Spaarrekening Naar Oranje spaarrekening K55335889 Valutadatum: 23-06-2025",
    "counterparty": "Oranje Spaarrekening",
    "amount": -50.0,
    "account": "ING",
    "subcategory": "Tussen rekeningen"
  },
  {
    "date": "2025-06-23",
    "description": "Oranje Spaarrekening Naar Oranje spaarrekening B39371145 Valutadatum: 23-06-2025",
    "counterparty": "Oranje Spaarrekening",
    "amount": -1000.0,
    "account": "ING",
    "subcategory": "Tussen rekeningen"
  },
  {
    "date": "2025-06-23",
    "description": "Oranje Spaarrekening Naar Oranje spaarrekening X42802618 Valutadatum: 23-06-2025",
    "counterparty": "Oranje Spaarrekening",
    "amount": -402.0,
    "account": "ING",
    "subcategory": "Tussen rekeningen"
  },
  {
    "date": "2025-06-25",
    "description": "J. Lek eo Kim Schut Naam: J. Lek eo Kim Schut Omschrijving: Vaste lasten IBAN: NL50RABO0330139916 Datum/Tijd: 25-06-2025 07:10:31 Valutadatum: 25-06-2025",
    "counterparty": "J. Lek eo Kim Schut",
    "amount": -3000.0,
    "account": "ING",
    "subcategory": "Tussen rekeningen"
  },
  {
    "date": "2025-06-25",
    "description": "Oranje Spaarrekening Van Oranje spaarrekening D12277903 Valutadatum: 25-06-2025",
    "counterparty": "Oranje Spaarrekening",
    "amount": 2200.0,
    "account": "ING",
    "subcategory": "Tussen rekeningen"
  },
  {
    "date": "2025-06-28",
    "description": "Oranje Spaarrekening Naar Oranje spaarrekening B39371145 Valutadatum: 28-06-2025",
    "counterparty": "Oranje Spaarrekening",
    "amount": -400.0,
    "account": "ING",
    "subcategory": "Tussen rekeningen"
  },
  {
    "date": "2025-06-29",
    "description": "Oranje Spaarrekening Naar Oranje spaarrekening Z77815333 Valutadatum: 29-06-2025",
    "counterparty": "Oranje Spaarrekening",
    "amount": -250.0,
    "account": "ING",
    "subcategory": "Tussen rekeningen"
  },
  {
    "date": "2025-07-01",
    "description": "Oranje Spaarrekening Naar Oranje spaarrekening B57393610 Valutadatum: 01-07-2025",
    "counterparty": "Oranje Spaarrekening",
    "amount": -250.0,
    "account": "ING",
    "subcategory": "Tussen rekeningen"
  },
  {
    "date": "2025-07-01",
    "description": "Oranje Spaarrekening Naar Oranje spaarrekening W12025282 Valutadatum: 01-07-2025",
    "counterparty": "Oranje Spaarrekening",
    "amount": -50.0,
    "account": "ING",
    "subcategory": "Tussen rekeningen"
  },
  {
    "date": "2025-07-01",
    "description": "Oranje Spaarrekening Naar Oranje spaarrekening W12025282 Valutadatum: 01-07-2025",
    "counterparty": "Oranje Spaarrekening",
    "amount": -200.0,
    "account": "ING",
    "subcategory": "Tussen rekeningen"
  },
  {
    "date": "2025-07-03",
    "description": "Oranje Spaarrekening Van Oranje spaarrekening X42802618 Valutadatum: 03-07-2025",
    "counterparty": "Oranje Spaarrekening",
    "amount": 100.0,
    "account": "ING",
    "subcategory": "Tussen rekeningen"
  },
  {
    "date": "2025-07-04",
    "description": "Oranje Spaarrekening Van Oranje spaarrekening W12025282 Valutadatum: 04-07-2025",
    "counterparty": "Oranje Spaarrekening",
    "amount": 700.0,
    "account": "ING",
    "subcategory": "Tussen rekeningen"
  },
  {
    "date": "2025-07-09",
    "description": "Oranje Spaarrekening Van Oranje spaarrekening B39371145 Valutadatum: 09-07-2025",
    "counterparty": "Oranje Spaarrekening",
    "amount": 100.0,
    "account": "ING",
    "subcategory": "Tussen rekeningen"
  },
  {
    "date": "2025-07-10",
    "description": "Oranje Spaarrekening Van Oranje spaarrekening X42802618 Valutadatum: 10-07-2025",
    "counterparty": "Oranje Spaarrekening",
    "amount": 100.0,
    "account": "ING",
    "subcategory": "Tussen rekeningen"
  },
  {
    "date": "2025-07-11",
    "description": "Oranje Spaarrekening Van Oranje spaarrekening B39371145 Valutadatum: 11-07-2025",
    "counterparty": "Oranje Spaarrekening",
    "amount": 130.0,
    "account": "ING",
    "subcategory": "Tussen rekeningen"
  },
  {
    "date": "2025-07-11",
    "description": "Oranje Spaarrekening Van Oranje spaarrekening Z77815333 Valutadatum: 11-07-2025",
    "counterparty": "Oranje Spaarrekening",
    "amount": 50.0,
    "account": "ING",
    "subcategory": "Tussen rekeningen"
  },
  {
    "date": "2025-07-12",
    "description": "Oranje Spaarrekening Van Oranje spaarrekening B39371145 Valutadatum: 12-07-2025",
    "counterparty": "Oranje Spaarrekening",
    "amount": 100.0,
    "account": "ING",
    "subcategory": "Tussen rekeningen"
  },
  {
    "date": "2025-07-12",
    "description": "Oranje Spaarrekening Van Oranje spaarrekening Z77815333 Valutadatum: 12-07-2025",
    "counterparty": "Oranje Spaarrekening",
    "amount": 550.0,
    "account": "ING",
    "subcategory": "Tussen rekeningen"
  },
  {
    "date": "2025-07-13",
    "description": "Oranje Spaarrekening Van Oranje spaarrekening B39371145 Valutadatum: 13-07-2025",
    "counterparty": "Oranje Spaarrekening",
    "amount": 140.0,
    "account": "ING",
    "subcategory": "Tussen rekeningen"
  },
  {
    "date": "2025-07-13",
    "description": "Oranje Spaarrekening Van Oranje spaarrekening B39371145 Valutadatum: 13-07-2025",
    "counterparty": "Oranje Spaarrekening",
    "amount": 106.0,
    "account": "ING",
    "subcategory": "Tussen rekeningen"
  },
  {
    "date": "2025-07-14",
    "description": "Oranje Spaarrekening Van Oranje spaarrekening X42802618 Valutadatum: 14-07-2025",
    "counterparty": "Oranje Spaarrekening",
    "amount": 88.0,
    "account": "ING",
    "subcategory": "Tussen rekeningen"
  },
  {
    "date": "2025-07-15",
    "description": "Oranje Spaarrekening Van Oranje spaarrekening B39371145 Valutadatum: 15-07-2025",
    "counterparty": "Oranje Spaarrekening",
    "amount": 222.0,
    "account": "ING",
    "subcategory": "Tussen rekeningen"
  },
  {
    "date": "2025-07-16",
    "description": "Oranje Spaarrekening Van Oranje spaarrekening B39371145 Valutadatum: 16-07-2025",
    "counterparty": "Oranje Spaarrekening",
    "amount": 100.0,
    "account": "ING",
    "subcategory": "Tussen rekeningen"
  },
  {
    "date": "2025-07-16",
    "description": "Oranje Spaarrekening Van Oranje spaarrekening B39371145 Valutadatum: 16-07-2025",
    "counterparty": "Oranje Spaarrekening",
    "amount": 100.0,
    "account": "ING",
    "subcategory": "Tussen rekeningen"
  },
  {
    "date": "2025-07-18",
    "description": "Oranje Spaarrekening Van Oranje spaarrekening B39371145 Valutadatum: 18-07-2025",
    "counterparty": "Oranje Spaarrekening",
    "amount": 1773.0,
    "account": "ING",
    "subcategory": "Tussen rekeningen"
  },
  {
    "date": "2025-07-19",
    "description": "Oranje Spaarrekening Van Oranje spaarrekening B39371145 Valutadatum: 19-07-2025",
    "counterparty": "Oranje Spaarrekening",
    "amount": 200.0,
    "account": "ING",
    "subcategory": "Tussen rekeningen"
  },
  {
    "date": "2025-07-20",
    "description": "Oranje Spaarrekening Van Oranje spaarrekening B39371145 Valutadatum: 20-07-2025",
    "counterparty": "Oranje Spaarrekening",
    "amount": 100.0,
    "account": "ING",
    "subcategory": "Tussen rekeningen"
  },
  {
    "date": "2025-07-20",
    "description": "Oranje Spaarrekening Van Oranje spaarrekening B39371145 Valutadatum: 20-07-2025",
    "counterparty": "Oranje Spaarrekening",
    "amount": 50.0,
    "account": "ING",
    "subcategory": "Tussen rekeningen"
  },
  {
    "date": "2025-07-21",
    "description": "Oranje Spaarrekening Van Oranje spaarrekening X42802618 Valutadatum: 21-07-2025",
    "counterparty": "Oranje Spaarrekening",
    "amount": 111.0,
    "account": "ING",
    "subcategory": "Tussen rekeningen"
  },
  {
    "date": "2025-07-21",
    "description": "Oranje Spaarrekening Naar Oranje spaarrekening K55335889 Valutadatum: 21-07-2025",
    "counterparty": "Oranje Spaarrekening",
    "amount": -50.0,
    "account": "ING",
    "subcategory": "Tussen rekeningen"
  },
  {
    "date": "2025-07-21",
    "description": "Oranje Spaarrekening Naar Oranje spaarrekening B39371145 Valutadatum: 21-07-2025",
    "counterparty": "Oranje Spaarrekening",
    "amount": -1000.0,
    "account": "ING",
    "subcategory": "Tussen rekeningen"
  },
  {
    "date": "2025-07-21",
    "description": "Oranje Spaarrekening Naar Oranje spaarrekening X42802618 Valutadatum: 21-07-2025",
    "counterparty": "Oranje Spaarrekening",
    "amount": -500.0,
    "account": "ING",
    "subcategory": "Tussen rekeningen"
  },
  {
    "date": "2025-07-22",
    "description": "J. Lek eo Kim Schut Naam: J. Lek eo Kim Schut IBAN: NL50RABO0330139916 Datum/Tijd: 22-07-2025 10:45:47 Valutadatum: 22-07-2025",
    "counterparty": "J. Lek eo Kim Schut",
    "amount": -3000.0,
    "account": "ING",
    "subcategory": "Tussen rekeningen"
  },
  {
    "date": "2025-07-22",
    "description": "Oranje Spaarrekening Van Oranje spaarrekening D12277903 Valutadatum: 22-07-2025",
    "counterparty": "Oranje Spaarrekening",
    "amount": 2200.0,
    "account": "ING",
    "subcategory": "Tussen rekeningen"
  },
  {
    "date": "2025-07-27",
    "description": "Oranje Spaarrekening Van Oranje spaarrekening B39371145 Valutadatum: 27-07-2025",
    "counterparty": "Oranje Spaarrekening",
    "amount": 2370.0,
    "account": "ING",
    "subcategory": "Tussen rekeningen"
  },
  {
    "date": "2025-07-28",
    "description": "Oranje Spaarrekening Van Oranje spaarrekening X42802618 Valutadatum: 28-07-2025",
    "counterparty": "Oranje Spaarrekening",
    "amount": 100.0,
    "account": "ING",
    "subcategory": "Tussen rekeningen"
  },
  {
    "date": "2025-07-29",
    "description": "Oranje Spaarrekening Naar Oranje spaarrekening Z77815333 Valutadatum: 29-07-2025",
    "counterparty": "Oranje Spaarrekening",
    "amount": -200.0,
    "account": "ING",
    "subcategory": "Tussen rekeningen"
  },
  {
    "date": "2025-08-02",
    "description": "Oranje Spaarrekening Van Oranje spaarrekening B39371145 Valutadatum: 02-08-2025",
    "counterparty": "Oranje Spaarrekening",
    "amount": 150.0,
    "account": "ING",
    "subcategory": "Tussen rekeningen"
  },
  {
    "date": "2025-08-03",
    "description": "Oranje Spaarrekening Van Oranje spaarrekening X42802618 Valutadatum: 03-08-2025",
    "counterparty": "Oranje Spaarrekening",
    "amount": 18.0,
    "account": "ING",
    "subcategory": "Tussen rekeningen"
  },
  {
    "date": "2025-08-04",
    "description": "Oranje Spaarrekening Van Oranje spaarrekening B39371145 Valutadatum: 04-08-2025",
    "counterparty": "Oranje Spaarrekening",
    "amount": 100.0,
    "account": "ING",
    "subcategory": "Tussen rekeningen"
  },
  {
    "date": "2025-08-05",
    "description": "Oranje Spaarrekening Van Oranje spaarrekening X42802618 Valutadatum: 05-08-2025",
    "counterparty": "Oranje Spaarrekening",
    "amount": 128.0,
    "account": "ING",
    "subcategory": "Tussen rekeningen"
  },
  {
    "date": "2025-08-07",
    "description": "Oranje Spaarrekening Van Oranje spaarrekening B39371145 Valutadatum: 07-08-2025",
    "counterparty": "Oranje Spaarrekening",
    "amount": 100.0,
    "account": "ING",
    "subcategory": "Tussen rekeningen"
  },
  {
    "date": "2025-08-08",
    "description": "Oranje Spaarrekening Van Oranje spaarrekening D12277903 Valutadatum: 08-08-2025",
    "counterparty": "Oranje Spaarrekening",
    "amount": 1000.0,
    "account": "ING",
    "subcategory": "Tussen rekeningen"
  },
  {
    "date": "2025-08-14",
    "description": "Oranje Spaarrekening Van Oranje spaarrekening X42802618 Valutadatum: 14-08-2025",
    "counterparty": "Oranje Spaarrekening",
    "amount": 125.0,
    "account": "ING",
    "subcategory": "Tussen rekeningen"
  },
  {
    "date": "2025-08-14",
    "description": "Oranje Spaarrekening Van Oranje spaarrekening B39371145 Valutadatum: 14-08-2025",
    "counterparty": "Oranje Spaarrekening",
    "amount": 62.0,
    "account": "ING",
    "subcategory": "Tussen rekeningen"
  },
  {
    "date": "2025-08-15",
    "description": "Oranje Spaarrekening Van Oranje spaarrekening B39371145 Valutadatum: 15-08-2025",
    "counterparty": "Oranje Spaarrekening",
    "amount": 100.0,
    "account": "ING",
    "subcategory": "Tussen rekeningen"
  },
  {
    "date": "2025-08-15",
    "description": "Oranje Spaarrekening Van Oranje spaarrekening X42802618 Valutadatum: 15-08-2025",
    "counterparty": "Oranje Spaarrekening",
    "amount": 20.0,
    "account": "ING",
    "subcategory": "Tussen rekeningen"
  },
  {
    "date": "2025-08-16",
    "description": "Oranje Spaarrekening Naar Oranje spaarrekening B39371145 Valutadatum: 16-08-2025",
    "counterparty": "Oranje Spaarrekening",
    "amount": -1800.0,
    "account": "ING",
    "subcategory": "Tussen rekeningen"
  },
  {
    "date": "2025-08-16",
    "description": "Oranje Spaarrekening Van Oranje spaarrekening R12933395 Valutadatum: 16-08-2025",
    "counterparty": "Oranje Spaarrekening",
    "amount": 1939.0,
    "account": "ING",
    "subcategory": "Tussen rekeningen"
  },
  {
    "date": "2025-08-16",
    "description": "Oranje Spaarrekening Van Oranje spaarrekening B39371145 Valutadatum: 16-08-2025",
    "counterparty": "Oranje Spaarrekening",
    "amount": 100.0,
    "account": "ING",
    "subcategory": "Tussen rekeningen"
  },
  {
    "date": "2025-08-16",
    "description": "Oranje Spaarrekening Van Oranje spaarrekening B39371145 Valutadatum: 16-08-2025",
    "counterparty": "Oranje Spaarrekening",
    "amount": 100.0,
    "account": "ING",
    "subcategory": "Tussen rekeningen"
  },
  {
    "date": "2025-08-17",
    "description": "Oranje Spaarrekening Van Oranje spaarrekening X42802618 Valutadatum: 17-08-2025",
    "counterparty": "Oranje Spaarrekening",
    "amount": 112.0,
    "account": "ING",
    "subcategory": "Tussen rekeningen"
  },
  {
    "date": "2025-08-18",
    "description": "Oranje Spaarrekening Van Oranje spaarrekening B39371145 Valutadatum: 18-08-2025",
    "counterparty": "Oranje Spaarrekening",
    "amount": 100.0,
    "account": "ING",
    "subcategory": "Tussen rekeningen"
  },
  {
    "date": "2025-08-20",
    "description": "Oranje Spaarrekening Naar Oranje spaarrekening X42802618 Valutadatum: 20-08-2025",
    "counterparty": "Oranje Spaarrekening",
    "amount": -500.0,
    "account": "ING",
    "subcategory": "Tussen rekeningen"
  },
  {
    "date": "2025-08-22",
    "description": "Oranje Spaarrekening Naar Oranje spaarrekening K55335889 Valutadatum: 22-08-2025",
    "counterparty": "Oranje Spaarrekening",
    "amount": -50.0,
    "account": "ING",
    "subcategory": "Tussen rekeningen"
  },
  {
    "date": "2025-08-22",
    "description": "J. Lek eo Kim Schut Naam: J. Lek eo Kim Schut Omschrijving: Vaste lasten IBAN: NL50RABO0330139916 Datum/Tijd: 22-08-2025 11:19:35 Valutadatum: 22-08-2025",
    "counterparty": "J. Lek eo Kim Schut",
    "amount": -3300.0,
    "account": "ING",
    "subcategory": "Tussen rekeningen"
  },
  {
    "date": "2025-08-22",
    "description": "Oranje Spaarrekening Van Oranje spaarrekening D12277903 Valutadatum: 22-08-2025",
    "counterparty": "Oranje Spaarrekening",
    "amount": 2200.0,
    "account": "ING",
    "subcategory": "Tussen rekeningen"
  },
  {
    "date": "2025-08-22",
    "description": "Oranje Spaarrekening Naar Oranje spaarrekening B39371145 Valutadatum: 22-08-2025",
    "counterparty": "Oranje Spaarrekening",
    "amount": -700.0,
    "account": "ING",
    "subcategory": "Tussen rekeningen"
  },
  {
    "date": "2025-08-25",
    "description": "Oranje Spaarrekening Van Oranje spaarrekening X42802618 Valutadatum: 25-08-2025",
    "counterparty": "Oranje Spaarrekening",
    "amount": 100.0,
    "account": "ING",
    "subcategory": "Tussen rekeningen"
  },
  {
    "date": "2025-08-29",
    "description": "Oranje Spaarrekening Naar Oranje spaarrekening Z77815333 Valutadatum: 29-08-2025",
    "counterparty": "Oranje Spaarrekening",
    "amount": -200.0,
    "account": "ING",
    "subcategory": "Tussen rekeningen"
  },
  {
    "date": "2025-09-02",
    "description": "Oranje Spaarrekening Van Oranje spaarrekening X42802618 Valutadatum: 02-09-2025",
    "counterparty": "Oranje Spaarrekening",
    "amount": 120.0,
    "account": "ING",
    "subcategory": "Tussen rekeningen"
  },
  {
    "date": "2025-09-08",
    "description": "Oranje Spaarrekening Van Oranje spaarrekening B39371145 Valutadatum: 08-09-2025",
    "counterparty": "Oranje Spaarrekening",
    "amount": 300.0,
    "account": "ING",
    "subcategory": "Tussen rekeningen"
  },
  {
    "date": "2025-09-09",
    "description": "Oranje Spaarrekening Van Oranje spaarrekening X42802618 Valutadatum: 09-09-2025",
    "counterparty": "Oranje Spaarrekening",
    "amount": 115.0,
    "account": "ING",
    "subcategory": "Tussen rekeningen"
  },
  {
    "date": "2025-09-10",
    "description": "Oranje Spaarrekening Van Oranje spaarrekening B39371145 Valutadatum: 10-09-2025",
    "counterparty": "Oranje Spaarrekening",
    "amount": 200.0,
    "account": "ING",
    "subcategory": "Tussen rekeningen"
  },
  {
    "date": "2025-09-12",
    "description": "Oranje Spaarrekening Van Oranje spaarrekening D12277903 Valutadatum: 12-09-2025",
    "counterparty": "Oranje Spaarrekening",
    "amount": 249.0,
    "account": "ING",
    "subcategory": "Tussen rekeningen"
  },
  {
    "date": "2025-09-12",
    "description": "Oranje Spaarrekening Van Oranje spaarrekening B39371145 Valutadatum: 12-09-2025",
    "counterparty": "Oranje Spaarrekening",
    "amount": 100.0,
    "account": "ING",
    "subcategory": "Tussen rekeningen"
  },
  {
    "date": "2025-09-15",
    "description": "Oranje Spaarrekening Van Oranje spaarrekening X42802618 Valutadatum: 15-09-2025",
    "counterparty": "Oranje Spaarrekening",
    "amount": 130.0,
    "account": "ING",
    "subcategory": "Tussen rekeningen"
  },
  {
    "date": "2025-09-15",
    "description": "Oranje Spaarrekening Van Oranje spaarrekening B39371145 Valutadatum: 15-09-2025",
    "counterparty": "Oranje Spaarrekening",
    "amount": 100.0,
    "account": "ING",
    "subcategory": "Tussen rekeningen"
  },
  {
    "date": "2025-09-15",
    "description": "Oranje Spaarrekening Van Oranje spaarrekening B39371145 Valutadatum: 15-09-2025",
    "counterparty": "Oranje Spaarrekening",
    "amount": 100.0,
    "account": "ING",
    "subcategory": "Tussen rekeningen"
  },
  {
    "date": "2025-09-16",
    "description": "Oranje Spaarrekening Naar Oranje spaarrekening D12277903 Valutadatum: 16-09-2025",
    "counterparty": "Oranje Spaarrekening",
    "amount": -5200.0,
    "account": "ING",
    "subcategory": "Tussen rekeningen"
  },
  {
    "date": "2025-09-19",
    "description": "Oranje Spaarrekening Van Oranje spaarrekening B39371145 Valutadatum: 19-09-2025",
    "counterparty": "Oranje Spaarrekening",
    "amount": 100.0,
    "account": "ING",
    "subcategory": "Tussen rekeningen"
  },
  {
    "date": "2025-09-22",
    "description": "Oranje Spaarrekening Naar Oranje spaarrekening D12277903 Valutadatum: 22-09-2025",
    "counterparty": "Oranje Spaarrekening",
    "amount": -1000.0,
    "account": "ING",
    "subcategory": "Tussen rekeningen"
  },
  {
    "date": "2025-09-22",
    "description": "Oranje Spaarrekening Naar Oranje spaarrekening B39371145 Valutadatum: 22-09-2025",
    "counterparty": "Oranje Spaarrekening",
    "amount": -1000.0,
    "account": "ING",
    "subcategory": "Tussen rekeningen"
  },
  {
    "date": "2025-09-22",
    "description": "Oranje Spaarrekening Naar Oranje spaarrekening K55335889 Valutadatum: 22-09-2025",
    "counterparty": "Oranje Spaarrekening",
    "amount": -50.0,
    "account": "ING",
    "subcategory": "Tussen rekeningen"
  },
  {
    "date": "2025-09-22",
    "description": "Oranje Spaarrekening Naar Oranje spaarrekening X42802618 Valutadatum: 22-09-2025",
    "counterparty": "Oranje Spaarrekening",
    "amount": -500.0,
    "account": "ING",
    "subcategory": "Tussen rekeningen"
  },
  {
    "date": "2025-09-22",
    "description": "Oranje Spaarrekening Naar Oranje spaarrekening B39371145 Valutadatum: 22-09-2025",
    "counterparty": "Oranje Spaarrekening",
    "amount": -700.0,
    "account": "ING",
    "subcategory": "Tussen rekeningen"
  },
  {
    "date": "2025-09-22",
    "description": "J. Lek eo Kim Schut Naam: J. Lek eo Kim Schut IBAN: NL50RABO0330139916 Datum/Tijd: 22-09-2025 13:59:07 Valutadatum: 22-09-2025",
    "counterparty": "J. Lek eo Kim Schut",
    "amount": -3300.0,
    "account": "ING",
    "subcategory": "Tussen rekeningen"
  },
  {
    "date": "2025-09-22",
    "description": "Oranje Spaarrekening Van Oranje spaarrekening D12277903 Valutadatum: 22-09-2025",
    "counterparty": "Oranje Spaarrekening",
    "amount": 5200.0,
    "account": "ING",
    "subcategory": "Tussen rekeningen"
  },
  {
    "date": "2025-09-24",
    "description": "Oranje Spaarrekening Van Oranje spaarrekening B57393610 Valutadatum: 24-09-2025",
    "counterparty": "Oranje Spaarrekening",
    "amount": 250.0,
    "account": "ING",
    "subcategory": "Tussen rekeningen"
  },
  {
    "date": "2025-09-29",
    "description": "Afblijfpotje Van Oranje spaarrekening D12277903 Valutadatum: 29-09-2025",
    "counterparty": "Afblijfpotje",
    "amount": 1351.0,
    "account": "ING",
    "subcategory": "Tussen rekeningen"
  },
  {
    "date": "2025-09-30",
    "description": "Oranje Spaarrekening Van Oranje spaarrekening X42802618 Valutadatum: 30-09-2025",
    "counterparty": "Oranje Spaarrekening",
    "amount": 100.0,
    "account": "ING",
    "subcategory": "Tussen rekeningen"
  },
  {
    "date": "2025-09-30",
    "description": "Oranje Spaarrekening Naar Oranje spaarrekening Z77815333 Valutadatum: 30-09-2025",
    "counterparty": "Oranje Spaarrekening",
    "amount": -200.0,
    "account": "ING",
    "subcategory": "Tussen rekeningen"
  },
  {
    "date": "2025-10-01",
    "description": "Oranje Spaarrekening Naar Oranje spaarrekening B57393610 Valutadatum: 01-10-2025",
    "counterparty": "Oranje Spaarrekening",
    "amount": -250.0,
    "account": "ING",
    "subcategory": "Tussen rekeningen"
  },
  {
    "date": "2025-10-01",
    "description": "Oranje Spaarrekening Naar Oranje spaarrekening W12025282 Valutadatum: 01-10-2025",
    "counterparty": "Oranje Spaarrekening",
    "amount": -250.0,
    "account": "ING",
    "subcategory": "Tussen rekeningen"
  },
  {
    "date": "2025-10-06",
    "description": "Oranje Spaarrekening Van Oranje spaarrekening X42802618 Valutadatum: 06-10-2025",
    "counterparty": "Oranje Spaarrekening",
    "amount": 100.0,
    "account": "ING",
    "subcategory": "Tussen rekeningen"
  },
  {
    "date": "2025-10-08",
    "description": "Oranje Spaarrekening Van Oranje spaarrekening X42802618 Valutadatum: 08-10-2025",
    "counterparty": "Oranje Spaarrekening",
    "amount": 35.0,
    "account": "ING",
    "subcategory": "Tussen rekeningen"
  },
  {
    "date": "2025-10-08",
    "description": "Oranje Spaarrekening Van Oranje spaarrekening B39371145 Valutadatum: 08-10-2025",
    "counterparty": "Oranje Spaarrekening",
    "amount": 100.0,
    "account": "ING",
    "subcategory": "Tussen rekeningen"
  },
  {
    "date": "2025-10-09",
    "description": "Oranje Spaarrekening Van Oranje spaarrekening B39371145 Valutadatum: 09-10-2025",
    "counterparty": "Oranje Spaarrekening",
    "amount": 100.0,
    "account": "ING",
    "subcategory": "Tussen rekeningen"
  },
  {
    "date": "2025-10-09",
    "description": "Oranje Spaarrekening Van Oranje spaarrekening B39371145 Valutadatum: 09-10-2025",
    "counterparty": "Oranje Spaarrekening",
    "amount": 100.0,
    "account": "ING",
    "subcategory": "Tussen rekeningen"
  },
  {
    "date": "2025-10-10",
    "description": "Oranje Spaarrekening Van Oranje spaarrekening B39371145 Valutadatum: 10-10-2025",
    "counterparty": "Oranje Spaarrekening",
    "amount": 100.0,
    "account": "ING",
    "subcategory": "Tussen rekeningen"
  },
  {
    "date": "2025-10-11",
    "description": "Oranje Spaarrekening Van Oranje spaarrekening B39371145 Valutadatum: 11-10-2025",
    "counterparty": "Oranje Spaarrekening",
    "amount": 200.0,
    "account": "ING",
    "subcategory": "Tussen rekeningen"
  },
  {
    "date": "2025-10-11",
    "description": "Oranje Spaarrekening Van Oranje spaarrekening B39371145 Valutadatum: 11-10-2025",
    "counterparty": "Oranje Spaarrekening",
    "amount": 100.0,
    "account": "ING",
    "subcategory": "Tussen rekeningen"
  },
  {
    "date": "2025-10-13",
    "description": "Oranje Spaarrekening Van Oranje spaarrekening X42802618 Valutadatum: 13-10-2025",
    "counterparty": "Oranje Spaarrekening",
    "amount": 101.0,
    "account": "ING",
    "subcategory": "Tussen rekeningen"
  },
  {
    "date": "2025-10-14",
    "description": "Oranje Spaarrekening Van Oranje spaarrekening B39371145 Valutadatum: 14-10-2025",
    "counterparty": "Oranje Spaarrekening",
    "amount": 64.65,
    "account": "ING",
    "subcategory": "Tussen rekeningen"
  },
  {
    "date": "2025-10-15",
    "description": "Oranje Spaarrekening Van Oranje spaarrekening B39371145 Valutadatum: 15-10-2025",
    "counterparty": "Oranje Spaarrekening",
    "amount": 100.0,
    "account": "ING",
    "subcategory": "Tussen rekeningen"
  },
  {
    "date": "2025-10-15",
    "description": "Oranje Spaarrekening Van Oranje spaarrekening B39371145 Valutadatum: 15-10-2025",
    "counterparty": "Oranje Spaarrekening",
    "amount": 132.0,
    "account": "ING",
    "subcategory": "Tussen rekeningen"
  },
  {
    "date": "2025-10-16",
    "description": "Oranje Spaarrekening Van Oranje spaarrekening B39371145 Valutadatum: 16-10-2025",
    "counterparty": "Oranje Spaarrekening",
    "amount": 100.0,
    "account": "ING",
    "subcategory": "Tussen rekeningen"
  },
  {
    "date": "2025-10-17",
    "description": "Oranje Spaarrekening Van Oranje spaarrekening B39371145 Valutadatum: 17-10-2025",
    "counterparty": "Oranje Spaarrekening",
    "amount": 50.0,
    "account": "ING",
    "subcategory": "Tussen rekeningen"
  },
  {
    "date": "2025-10-18",
    "description": "J. Lek eo K. Schut Naam: J. Lek eo K. Schut Omschrijving: Declaratie ziektekosten mallorca fbto IBAN: NL50RABO0330139916 Datum/Tijd: 18-10-2025 00:05:29 Valutadatum: 18-10-2025",
    "counterparty": "J. Lek eo K. Schut",
    "amount": 115.0,
    "account": "ING",
    "subcategory": "Tussen rekeningen"
  },
  {
    "date": "2025-10-19",
    "description": "Oranje Spaarrekening Van Oranje spaarrekening B39371145 Valutadatum: 19-10-2025",
    "counterparty": "Oranje Spaarrekening",
    "amount": 130.0,
    "account": "ING",
    "subcategory": "Tussen rekeningen"
  },
  {
    "date": "2025-10-20",
    "description": "Oranje Spaarrekening Van Oranje spaarrekening X42802618 Valutadatum: 20-10-2025",
    "counterparty": "Oranje Spaarrekening",
    "amount": 199.0,
    "account": "ING",
    "subcategory": "Tussen rekeningen"
  },
  {
    "date": "2025-10-21",
    "description": "Oranje Spaarrekening Van Oranje spaarrekening B39371145 Valutadatum: 21-10-2025",
    "counterparty": "Oranje Spaarrekening",
    "amount": 200.0,
    "account": "ING",
    "subcategory": "Tussen rekeningen"
  },
  {
    "date": "2025-10-23",
    "description": "Oranje Spaarrekening Naar Oranje spaarrekening B39371145 Valutadatum: 23-10-2025",
    "counterparty": "Oranje Spaarrekening",
    "amount": -16662.0,
    "account": "ING",
    "subcategory": "Tussen rekeningen"
  },
  {
    "date": "2025-10-23",
    "description": "Mw K Schut, Hr J Lek Van Oranje spaarrekening D12277903 Valutadatum: 23-10-2025",
    "counterparty": "Mw K Schut, Hr J Lek",
    "amount": 16662.71,
    "account": "ING",
    "subcategory": "Tussen rekeningen"
  },
  {
    "date": "2025-10-23",
    "description": "Oranje Spaarrekening Naar Oranje spaarrekening D12277903 Valutadatum: 23-10-2025",
    "counterparty": "Oranje Spaarrekening",
    "amount": -700.0,
    "account": "ING",
    "subcategory": "Tussen rekeningen"
  },
  {
    "date": "2025-10-23",
    "description": "Oranje Spaarrekening Naar Oranje spaarrekening B39371145 Valutadatum: 23-10-2025",
    "counterparty": "Oranje Spaarrekening",
    "amount": -1000.0,
    "account": "ING",
    "subcategory": "Tussen rekeningen"
  },
  {
    "date": "2025-10-23",
    "description": "Oranje Spaarrekening Naar Oranje spaarrekening X42802618 Valutadatum: 23-10-2025",
    "counterparty": "Oranje Spaarrekening",
    "amount": -500.0,
    "account": "ING",
    "subcategory": "Tussen rekeningen"
  },
  {
    "date": "2025-10-23",
    "description": "Oranje Spaarrekening Naar Oranje spaarrekening K55335889 Valutadatum: 23-10-2025",
    "counterparty": "Oranje Spaarrekening",
    "amount": -50.0,
    "account": "ING",
    "subcategory": "Tussen rekeningen"
  },
  {
    "date": "2025-10-23",
    "description": "J. Lek eo Kim Schut Naam: J. Lek eo Kim Schut Omschrijving: Vaste lasten IBAN: NL50RABO0330139916 Datum/Tijd: 23-10-2025 12:46:56 Valutadatum: 23-10-2025",
    "counterparty": "J. Lek eo Kim Schut",
    "amount": -3300.0,
    "account": "ING",
    "subcategory": "Tussen rekeningen"
  },
  {
    "date": "2025-10-27",
    "description": "Oranje Spaarrekening Van Oranje spaarrekening X42802618 Valutadatum: 27-10-2025",
    "counterparty": "Oranje Spaarrekening",
    "amount": 130.0,
    "account": "ING",
    "subcategory": "Tussen rekeningen"
  },
  {
    "date": "2025-11-04",
    "description": "Oranje Spaarrekening Van Oranje spaarrekening B39371145 Valutadatum: 04-11-2025",
    "counterparty": "Oranje Spaarrekening",
    "amount": 430.0,
    "account": "ING",
    "subcategory": "Tussen rekeningen"
  },
  {
    "date": "2025-11-04",
    "description": "Oranje Spaarrekening Van Oranje spaarrekening X42802618 Valutadatum: 04-11-2025",
    "counterparty": "Oranje Spaarrekening",
    "amount": 140.0,
    "account": "ING",
    "subcategory": "Tussen rekeningen"
  },
  {
    "date": "2025-11-05",
    "description": "Oranje Spaarrekening Van Oranje spaarrekening B39371145 Valutadatum: 05-11-2025",
    "counterparty": "Oranje Spaarrekening",
    "amount": 920.0,
    "account": "ING",
    "subcategory": "Tussen rekeningen"
  },
  {
    "date": "2025-11-12",
    "description": "Oranje Spaarrekening Van Oranje spaarrekening B39371145 Valutadatum: 12-11-2025",
    "counterparty": "Oranje Spaarrekening",
    "amount": 200.0,
    "account": "ING",
    "subcategory": "Tussen rekeningen"
  },
  {
    "date": "2025-11-15",
    "description": "Oranje Spaarrekening Van Oranje spaarrekening B39371145 Valutadatum: 15-11-2025",
    "counterparty": "Oranje Spaarrekening",
    "amount": 200.0,
    "account": "ING",
    "subcategory": "Tussen rekeningen"
  },
  {
    "date": "2025-11-16",
    "description": "Oranje Spaarrekening Van Oranje spaarrekening X42802618 Valutadatum: 16-11-2025",
    "counterparty": "Oranje Spaarrekening",
    "amount": 200.0,
    "account": "ING",
    "subcategory": "Tussen rekeningen"
  },
  {
    "date": "2025-11-17",
    "description": "Oranje Spaarrekening Van Oranje spaarrekening B39371145 Valutadatum: 17-11-2025",
    "counterparty": "Oranje Spaarrekening",
    "amount": 89.0,
    "account": "ING",
    "subcategory": "Tussen rekeningen"
  },
  {
    "date": "2025-11-17",
    "description": "Oranje Spaarrekening Van Oranje spaarrekening B39371145 Valutadatum: 17-11-2025",
    "counterparty": "Oranje Spaarrekening",
    "amount": 71.0,
    "account": "ING",
    "subcategory": "Tussen rekeningen"
  },
  {
    "date": "2025-11-19",
    "description": "Oranje Spaarrekening Van Oranje spaarrekening B39371145 Valutadatum: 19-11-2025",
    "counterparty": "Oranje Spaarrekening",
    "amount": 100.0,
    "account": "ING",
    "subcategory": "Tussen rekeningen"
  },
  {
    "date": "2025-11-19",
    "description": "Oranje Spaarrekening Van Oranje spaarrekening B39371145 Valutadatum: 19-11-2025",
    "counterparty": "Oranje Spaarrekening",
    "amount": 75.0,
    "account": "ING",
    "subcategory": "Tussen rekeningen"
  },
  {
    "date": "2025-11-19",
    "description": "Oranje Spaarrekening Van Oranje spaarrekening X42802618 Valutadatum: 19-11-2025",
    "counterparty": "Oranje Spaarrekening",
    "amount": 30.0,
    "account": "ING",
    "subcategory": "Tussen rekeningen"
  },
  {
    "date": "2025-11-21",
    "description": "Oranje Spaarrekening Naar Oranje spaarrekening B39371145 Valutadatum: 21-11-2025",
    "counterparty": "Oranje Spaarrekening",
    "amount": -2000.0,
    "account": "ING",
    "subcategory": "Tussen rekeningen"
  },
  {
    "date": "2025-11-21",
    "description": "J. Lek eo Kim Schut Naam: J. Lek eo Kim Schut Omschrijving: Vaste lasten IBAN: NL50RABO0330139916 Datum/Tijd: 21-11-2025 10:05:00 Valutadatum: 21-11-2025",
    "counterparty": "J. Lek eo Kim Schut",
    "amount": -3300.0,
    "account": "ING",
    "subcategory": "Tussen rekeningen"
  },
  {
    "date": "2025-11-21",
    "description": "Oranje Spaarrekening Naar Oranje spaarrekening K55335889 Valutadatum: 21-11-2025",
    "counterparty": "Oranje Spaarrekening",
    "amount": -50.0,
    "account": "ING",
    "subcategory": "Tussen rekeningen"
  },
  {
    "date": "2025-11-21",
    "description": "Oranje Spaarrekening Naar Oranje spaarrekening X42802618 Valutadatum: 21-11-2025",
    "counterparty": "Oranje Spaarrekening",
    "amount": -650.0,
    "account": "ING",
    "subcategory": "Tussen rekeningen"
  },
  {
    "date": "2025-11-25",
    "description": "Oranje Spaarrekening Van Oranje spaarrekening X42802618 Valutadatum: 25-11-2025",
    "counterparty": "Oranje Spaarrekening",
    "amount": 30.0,
    "account": "ING",
    "subcategory": "Tussen rekeningen"
  },
  {
    "date": "2025-11-25",
    "description": "Oranje Spaarrekening Van Oranje spaarrekening X42802618 Valutadatum: 25-11-2025",
    "counterparty": "Oranje Spaarrekening",
    "amount": 99.0,
    "account": "ING",
    "subcategory": "Tussen rekeningen"
  },
  {
    "date": "2025-11-26",
    "description": "Oranje Spaarrekening Van Oranje spaarrekening X42802618 Valutadatum: 26-11-2025",
    "counterparty": "Oranje Spaarrekening",
    "amount": 29.0,
    "account": "ING",
    "subcategory": "Tussen rekeningen"
  },
  {
    "date": "2025-11-28",
    "description": "Oranje Spaarrekening Van Oranje spaarrekening B39371145 Belastingdienst Valutadatum: 28-11-2025",
    "counterparty": "Oranje Spaarrekening",
    "amount": 1866.0,
    "account": "ING",
    "subcategory": "Tussen rekeningen"
  },
  {
    "date": "2025-11-28",
    "description": "Oranje Spaarrekening Van Oranje spaarrekening B39371145 Valutadatum: 28-11-2025",
    "counterparty": "Oranje Spaarrekening",
    "amount": 500.0,
    "account": "ING",
    "subcategory": "Tussen rekeningen"
  }
]